{
  "id": "foundations-review",
  "title": { "ja": "基礎横断レビュー", "en": "Foundations Cumulative Review" },
  "module_ids": ["module-prerequisites-vectors", "module-systems-matrices", "module-vector-spaces"],
  "exercise_ids": ["module-prerequisites-vectors-exercise-basic", "module-systems-matrices-exercise-conceptual"]
}
